{
  "schemaVersion": 2,
  "id": "codex",
  "displayName": "OpenAI Codex CLI",
  "kind": "cli",
  "binary": {
    "windows": ["%APPDATA%\\npm\\codex.cmd", "%APPDATA%\\npm\\codex", "codex"],
    "macos": ["/usr/local/bin/codex", "$HOME/.npm-global/bin/codex", "codex"],
    "linux": ["$HOME/.npm-global/bin/codex", "/usr/local/bin/codex", "codex"]
  },
  "isolation": {
    "strategy": "accountOverlay",
    "mode": "foreground",
    "env": { "CODEX_HOME": "{runtimeRoot}" },
    "clearEnv": []
  },
  "account": {
    "mechanism": "fileOverlay",
    "credentialFiles": ["auth.json"],
    "credentialPrecedence": ["auth.json"],
    "logoutScope": "profile"
  },
  "normalState": {
    "root": {
      "windows": "%USERPROFILE%\\.codex",
      "macos": "$HOME/.codex",
      "linux": "$HOME/.codex"
    },
    "sharedPaths": [
      "config.toml", "hooks.json", "skills", "agents", "prompts", "mcp-configs", "plugins"
    ],
    "sessionPaths": ["sessions", "history.jsonl", "archived_sessions", "session_index.jsonl"],
    "filePaths": ["config.toml", "hooks.json", "history.jsonl", "session_index.jsonl"],
    "unsafePaths": []
  },
  "concurrency": { "level": "multiWriter", "singletonScope": "none" },
  "support": {
    "windows": { "level": "supported", "reason": "file overlay; file credential store mode" },
    "macos": { "level": "supported" },
    "linux": { "level": "supported" }
  },
  "install": "npm i -g @openai/codex",
  "versionCommand": ["--version"]
}
