{
  "id": "gemini-cli",
  "displayName": "Gemini CLI",
  "kind": "cli",
  "binary": {
    "windows": ["%APPDATA%\\npm\\gemini.cmd", "%APPDATA%\\npm\\gemini", "gemini"],
    "macos":   ["/usr/local/bin/gemini", "$HOME/.npm-global/bin/gemini", "gemini"],
    "linux":   ["$HOME/.npm-global/bin/gemini", "gemini"]
  },
  "isolation": {
    "strategy": "env",
    "env": { "GEMINI_CLI_HOME": "{profileDir}" }
  },
  "share": {
    "systemHome":  "$HOME/.gemini",
    "linkable":    ["settings.json", "skills", "GEMINI.md"],
    "neverLink":   ["oauth_creds.json", "google_accounts.json", "history"]
  },
  "session": {
    "portable":    true,
    "paths":       ["tmp"],
    "credentials": ["oauth_creds.json", "google_accounts.json"],
    "resumeHint":  "Resume a copied conversation with `gemini --resume` or `/chat resume` inside the session."
  },
  "install": "npm i -g @google/gemini-cli",
  "versionCommand": ["--version"],
  "status": "stable"
}
