{
  "schemaVersion": 2,
  "id": "opencode",
  "displayName": "OpenCode",
  "kind": "cli",
  "binary": {
    "windows": ["%APPDATA%\\npm\\opencode.cmd", "%APPDATA%\\npm\\opencode", "opencode"],
    "macos": ["/usr/local/bin/opencode", "$HOME/.npm-global/bin/opencode", "opencode"],
    "linux": ["$HOME/.npm-global/bin/opencode", "opencode"]
  },
  "isolation": {
    "strategy": "accountOverlay",
    "mode": "foreground",
    "env": {
      "OPENCODE_CONFIG_DIR": "{runtimeRoot}",
      "OPENCODE_CONFIG": "{runtimeRoot}/opencode.json"
    },
    "clearEnv": []
  },
  "account": {
    "mechanism": "inseparable",
    "credentialFiles": [],
    "credentialPrecedence": [],
    "logoutScope": "user",
    "reason": "Stored provider authentication and runtime data do not have a proven disjoint profile boundary."
  },
  "normalState": {
    "root": {
      "windows": "%USERPROFILE%\\.config\\opencode",
      "macos": "$HOME/.config/opencode",
      "linux": "$HOME/.config/opencode"
    },
    "sharedPaths": ["opencode.json", "tui.json", "agents", "commands", "modes", "plugins", "skills", "tools", "themes"],
    "sessionPaths": [],
    "filePaths": ["opencode.json", "tui.json"],
    "unsafePaths": []
  },
  "concurrency": { "level": "unsupported", "singletonScope": "unknown" },
  "support": {
    "windows": { "level": "supported", "reason": "--isolated whole-root; auth and sessions share one database" },
    "macos": { "level": "supported" },
    "linux": { "level": "supported" }
  },
  "install": "npm i -g opencode-ai",
  "versionCommand": ["--version"]
}
