{
  "schemaVersion": 2,
  "id": "gemini-cli",
  "displayName": "Gemini CLI",
  "kind": "cli",
  "binary": {
    "windows": ["%APPDATA%\\npm\\gemini.cmd", "%APPDATA%\\npm\\gemini", "gemini"],
    "macos": ["/usr/local/bin/gemini", "$HOME/.npm-global/bin/gemini", "gemini"],
    "linux": ["$HOME/.npm-global/bin/gemini", "gemini"]
  },
  "isolation": {
    "strategy": "accountOverlay",
    "mode": "foreground",
    "env": { "GEMINI_CLI_HOME": "{runtimeRoot}" },
    "clearEnv": []
  },
  "account": {
    "mechanism": "fileOverlay",
    "credentialFiles": ["oauth_creds.json", "google_accounts.json", "mcp-oauth-tokens.json", "a2a-oauth-tokens.json"],
    "credentialPrecedence": ["oauth_creds.json", "google_accounts.json"],
    "logoutScope": "profile"
  },
  "normalState": {
    "root": {
      "windows": "%USERPROFILE%\\.gemini",
      "macos": "$HOME/.gemini",
      "linux": "$HOME/.gemini"
    },
    "sharedPaths": [
      "settings.json", "trustedFolders.json", "installation_id", "commands", "skills", "policies",
      "keybindings.json", "agents", "acknowledgments", "policy_integrity.json", "projects.json"
    ],
    "sessionPaths": ["tmp", "history"],
    "filePaths": [
      "settings.json", "trustedFolders.json", "installation_id", "keybindings.json",
      "policy_integrity.json", "projects.json"
    ],
    "unsafePaths": []
  },
  "concurrency": { "level": "multiWriter", "singletonScope": "none" },
  "support": {
    "windows": { "level": "supported", "reason": "file overlay" },
    "macos": { "level": "supported" },
    "linux": { "level": "supported" }
  },
  "install": "npm i -g @google/gemini-cli",
  "versionCommand": ["--version"]
}
