{
  "id": "opencode",
  "displayName": "OpenCode",
  "kind": "cli",
  "binary": {
    "windows": ["%APPDATA%\\npm\\opencode.cmd", "%APPDATA%\\npm\\opencode", "opencode"],
    "macos":   ["/usr/local/bin/opencode", "$HOME/.npm-global/bin/opencode", "opencode"],
    "linux":   ["$HOME/.npm-global/bin/opencode", "opencode"]
  },
  "isolation": {
    "strategy": "env",
    "env": {
      "OPENCODE_CONFIG_DIR": "{profileDir}",
      "OPENCODE_CONFIG":     "{profileDir}/opencode.json"
    }
  },
  "share": {
    "systemHome":  "$HOME/.config/opencode",
    "linkable":    ["agents", "commands", "modes", "plugins"],
    "neverLink":   ["auth.json"]
  },
  "session": {
    "portable": false,
    "reason":   "Sessions and credentials share one sqlite database (opencode.db) and cannot be separated safely."
  },
  "install": "npm i -g opencode-ai",
  "versionCommand": ["--version"],
  "status": "stable"
}
