{
  "schemaVersion": 2,
  "id": "kiro",
  "displayName": "Kiro IDE",
  "kind": "ide",
  "binary": { "windows": ["kiro"], "macos": ["kiro"], "linux": ["kiro"] },
  "isolation": { "strategy": "accountOverlay", "mode": "detached", "env": {}, "clearEnv": [] },
  "account": {
    "mechanism": "osUserCredentialStore",
    "credentialFiles": [],
    "credentialPrecedence": ["IDE browser/IAM sign-in"],
    "logoutScope": "osUser"
  },
  "normalState": {
    "root": { "windows": "%USERPROFILE%\\.kiro", "macos": "$HOME/.kiro", "linux": "$HOME/.kiro" },
    "sharedPaths": [],
    "sessionPaths": [],
    "filePaths": [],
    "unsafePaths": []
  },
  "concurrency": { "level": "singleWriter", "singletonScope": "osUser" },
  "support": {
    "windows": { "level": "supported", "reason": "OS-user isolation for concurrent IDE accounts; elevated terminal required" },
    "macos": { "level": "supported", "reason": "OS-user isolation with sudo" },
    "linux": { "level": "supported", "reason": "OS-user isolation with sudo and acl" }
  },
  "install": "https://kiro.dev/docs/getting-started/installation/",
  "versionCommand": ["--version"]
}
