{
  "schemaVersion": 2,
  "id": "commandcode",
  "displayName": "Command Code",
  "kind": "cli",
  "binary": {
    "windows": ["%APPDATA%\\npm\\commandcode.cmd", "%APPDATA%\\npm\\commandcode", "commandcode"],
    "macos": ["/usr/local/bin/commandcode", "$HOME/.npm-global/bin/commandcode", "commandcode"],
    "linux": ["$HOME/.npm-global/bin/commandcode", "/usr/local/bin/commandcode", "commandcode"]
  },
  "isolation": {
    "strategy": "accountOverlay",
    "mode": "foreground",
    "env": {
      "HOME": "{runtimeRoot}",
      "USERPROFILE": "{runtimeRoot}"
    },
    "clearEnv": ["COMMAND_CODE_API_KEY"]
  },
  "account": {
    "mechanism": "fileOverlay",
    "credentialFiles": ["auth.json"],
    "credentialPrecedence": ["COMMAND_CODE_API_KEY", ".commandcode/auth.json"],
    "logoutScope": "profile"
  },
  "normalState": {
    "root": {
      "windows": "%USERPROFILE%",
      "macos": "$HOME",
      "linux": "$HOME"
    },
    "runtimeSubdir": ".commandcode",
    "sharedPaths": ["config.json", "settings.json", "skills", "plans", "taste"],
    "sessionPaths": ["projects", "history.jsonl", "file-history"],
    "filePaths": ["config.json", "settings.json", "history.jsonl"],
    "unsafePaths": []
  },
  "concurrency": { "level": "multiWriter", "singletonScope": "none" },
  "support": {
    "windows": { "level": "supported", "reason": "file overlay (.commandcode/auth.json); use commandcode, bare cmd collides with cmd.exe" },
    "macos": { "level": "supported" },
    "linux": { "level": "supported" }
  },
  "install": "npm i -g command-code",
  "versionCommand": ["--version"]
}
